{
  "actors": [],
  "artifacts": [],
  "blocker_id": "HB-BLK-EXT-005",
  "checks": [
    {
      "case_id": "UNEXECUTED",
      "evidence_digest": null,
      "status": "UNEXECUTED"
    }
  ],
  "claims": {
    "authority_effect": "NONE",
    "compatibility_claim": false,
    "migration_authority": false,
    "production_authority": false,
    "qualification": false,
    "release_authority": false,
    "selected_candidates": [],
    "selection_effect": "NONE"
  },
  "findings": [],
  "repository": {
    "full_name": "TrillionniumFoundation/HeptaBao",
    "id": 1349115072
  },
  "schema": "heptabao.external-completion-evidence.v1",
  "scope": [],
  "separation": {},
  "signatures": [],
  "source": {
    "base_commit": null,
    "commit": null,
    "manifest_digest": null,
    "merge_commit": null,
    "merge_parent_one": null,
    "merge_parent_two": null,
    "merge_tree": null,
    "plan_digest": null,
    "tree": null
  },
  "state": "UNEXECUTED"
}
